"baker","series","episode","signature_bake","show_stopper","baker_age","baker_occupation","hometown","technical","result"
"Liam",8,8,"'Take Out' Bedfordshire Clangers","'Fort Wizardore' Savoy Cake",19,"Student","North London","5","OUT"
"Sophie",8,8,"Char Siu & Banana Praline Bedfordshire Clangers","Citrus with Green Apple Croquembouche Savoy Cake",33,"Former army officer and trainee stuntwoman","West Molesey, Surrey","4","IN"
"Stacey",8,8,"Camembert & Onion and Apple & Blueberry Bedfordshire Clangers","'Bright' Lemon & Orange Savoy Cake",42,"Former school teacher","Radlett, Hertfordshire","3","STAR BAKER"
"Steven",8,8,"'Mediterranean Medley' Bedfordshire Clangers","Chestnut Rum Savoy Cake",34,"Marketer","Watford, Hertfordshire","1","IN"
"Kate",8,9,"Bellini and Valencian Orange Choux Buns","'Rainbow' Meringue Centrepiece",29,"Health and safety inspector","Merseyside","4","IN"
"Sophie",8,9,"Strawberry & Rhubarb and Chestnut & Vanilla Choux Buns","'Tutu with Opera Filling' Meringue Centrepiece",33,"Former army officer and trainee stuntwoman","West Molesey, Surrey","1","STAR BAKER"
"Stacey",8,9,"'Choux-nicorn and Choux-moji' Choux Buns","'Flamingos in Love' Meringue Centrepiece",42,"Former school teacher","Radlett, Hertfordshire","2","OUT"
"Steven",8,9,"Key Lime Cheesecake and Bakewell Tart Choux Buns","'Some Air Over the Rainbow' Meringue Centrepiece",34,"Marketer","Watford, Hertfordshire","3","IN"
"Kate",8,10,"Roman Spelt, Coconut Kala Chana and Flower Breads","White Chocolate, Yuzu and Lychee Entremet",29,"Health and safety inspector","Merseyside","3","Runner-up"
"Sophie",8,10,"Spelt Boules, Mushroom Ciabatta and Orange Plaited Brioche","'Ode to the Honey Bee' Entremet",33,"Former army officer and trainee stuntwoman","West Molesey, Surrey","2","WINNER"
"Steven",8,10,"Spelt & Rye, Toasted Garlic & Fontina and Sweet Chocolate Breads","'Yin Yang' Entremet",34,"Marketer","Watford, Hertfordshire","1","Runner-up"
